{
  "$schema": "token",
  "categories": ["Curve LP Tokens"],
  "description": "This token represents a Curve liquidity pool. Holders earn fees from users trading in the pool, and can also deposit the LP to Curve's gauges to earn CRV emissions. This pool contains ibCHF, a synthetic Swiss franc minted from the Iron Bank, and synthetic Swiss franc (sCHF) minted on the Synthetix platform.",
  "website": "https://curve.fi/factory/31",
  "tokenSymbolOverride": "crvIBCHF",
  "tokenNameOverride": "Curve ibCHF Pool"
}
