{
  "$schema": "token",
  "categories": ["Curve LP Tokens"],
  "description": "This token represents a Curve liquidity pool. Holders earn fees from users trading in the pool, and can also deposit the LP to Curve's gauges to earn CRV emissions. This metapool contains 3Crv (DAI, USDC, and USDT) and DOLA, a synthetic USD stablecoin that can be minted by using other assets on Inverse Finance (https://www.inverse.finance) as collateral.",
  "website": "https://curve.fi",
  "tokenSymbolOverride": "crvDOLA",
  "tokenNameOverride": "Curve DOLA Pool"
}
