{
  "$schema": "token",
  "categories": ["Curve LP Tokens"],
  "description": "This token represents a Curve liquidity pool. Holders earn fees from users trading in the pool, and can also deposit the LP to Curve's gauges to earn CRV emissions. This factory metapool contains 3Crv (DAI, USDC, and USDT) and Binance USD, a regulated stablecoin issued by Paxos.",
  "website": "https://curve.fi/busdv2",
  "tokenSymbolOverride": "crvBUSD",
  "tokenNameOverride": "Curve BUSD Pool"
}
