{
  "$schema": "token",
  "categories": ["Curve LP Tokens"],
  "description": "This token represents a Curve liquidity pool. Holders earn fees from users trading in the pool, and can also deposit the LP to Curve's gauges to earn CRV emissions. This pool contains EURS and synthetic euro (sEUR) minted on the Synthetix platform.",
  "website": "https://www.curve.fi/eurs/",
  "tokenSymbolOverride": "crvEURS",
  "tokenNameOverride": "Curve EURS Pool"
}
